{
  "catalog_id": "ATC-ALGORITHM-FUNCTION-CATALOG",
  "catalog_version": "0.1.0",
  "catalog_status": "SOURCE_INVENTORY_BASELINE_NOT_COMPLETE",
  "normative": false,
  "repository": "A-TownChain-Okosystems/atc-algorithm",
  "source_ref": "main",
  "source_tree_sha": "5a5628044ef4daacca943062eac3fd27a2eaec93",
  "scope": {
    "languages": [
      "Rust",
      "Python"
    ],
    "included": "Function declarations in src/**/*.rs and discovered *.py files; includes test functions",
    "excluded": [
      "YAML workflows and declarative registries are not functions and are inventoried separately",
      "Rust macro-generated functions and dynamically generated callables may not be statically discovered"
    ],
    "limitations": [
      "Signature text is source excerpt, not a parsed type-level contract",
      "Function names/signatures do not establish behavior",
      "Normative consensus semantics remain BLOCKED until specs are frozen"
    ]
  },
  "summary": {
    "source_files": 6,
    "functions_discovered": 37,
    "tests_detected": 18,
    "semantic_contracts_verified": 0
  },
  "functions": [
    {
      "id": "src/economics.rs#epoch@28",
      "name": "epoch",
      "kind": "rust_function",
      "source": {
        "path": "src/economics.rs",
        "line_start": 28,
        "sha": "f415428712ad99302ff54d6e090cb72e600570b6"
      },
      "signature_source": "pub const fn epoch(height: u64) -> u32 {",
      "docstring": null,
      "status": "DISCOVERED_NOT_SEMANTICALLY_VERIFIED",
      "contract": {
        "preconditions": "UNSPECIFIED",
        "postconditions": "UNSPECIFIED",
        "errors": "UNSPECIFIED",
        "side_effects": "UNSPECIFIED",
        "determinism": "UNSPECIFIED",
        "security_invariants": "UNSPECIFIED"
      },
      "evidence": {
        "tests": "NOT_RECONCILED",
        "exact_sha": "5a5628044ef4daacca943062eac3fd27a2eaec93"
      }
    },
    {
      "id": "src/economics.rs#raw_subsidy@33",
      "name": "raw_subsidy",
      "kind": "rust_function",
      "source": {
        "path": "src/economics.rs",
        "line_start": 33,
        "sha": "f415428712ad99302ff54d6e090cb72e600570b6"
      },
      "signature_source": "pub const fn raw_subsidy(height: u64) -> u128 {",
      "docstring": null,
      "status": "DISCOVERED_NOT_SEMANTICALLY_VERIFIED",
      "contract": {
        "preconditions": "UNSPECIFIED",
        "postconditions": "UNSPECIFIED",
        "errors": "UNSPECIFIED",
        "side_effects": "UNSPECIFIED",
        "determinism": "UNSPECIFIED",
        "security_invariants": "UNSPECIFIED"
      },
      "evidence": {
        "tests": "NOT_RECONCILED",
        "exact_sha": "5a5628044ef4daacca943062eac3fd27a2eaec93"
      }
    },
    {
      "id": "src/economics.rs#subsidy@39",
      "name": "subsidy",
      "kind": "rust_function",
      "source": {
        "path": "src/economics.rs",
        "line_start": 39,
        "sha": "f415428712ad99302ff54d6e090cb72e600570b6"
      },
      "signature_source": "pub const fn subsidy(height: u64, issued_before_block: u128) -> u128 {",
      "docstring": null,
      "status": "DISCOVERED_NOT_SEMANTICALLY_VERIFIED",
      "contract": {
        "preconditions": "UNSPECIFIED",
        "postconditions": "UNSPECIFIED",
        "errors": "UNSPECIFIED",
        "side_effects": "UNSPECIFIED",
        "determinism": "UNSPECIFIED",
        "security_invariants": "UNSPECIFIED"
      },
      "evidence": {
        "tests": "NOT_RECONCILED",
        "exact_sha": "5a5628044ef4daacca943062eac3fd27a2eaec93"
      }
    },
    {
      "id": "src/economics.rs#protocol_constants_are_fixed@52",
      "name": "protocol_constants_are_fixed",
      "kind": "test_function",
      "source": {
        "path": "src/economics.rs",
        "line_start": 52,
        "sha": "f415428712ad99302ff54d6e090cb72e600570b6"
      },
      "signature_source": "fn protocol_constants_are_fixed() {",
      "docstring": null,
      "status": "DISCOVERED_NOT_SEMANTICALLY_VERIFIED",
      "contract": {
        "preconditions": "UNSPECIFIED",
        "postconditions": "UNSPECIFIED",
        "errors": "UNSPECIFIED",
        "side_effects": "UNSPECIFIED",
        "determinism": "UNSPECIFIED",
        "security_invariants": "UNSPECIFIED"
      },
      "evidence": {
        "tests": "NOT_RECONCILED",
        "exact_sha": "5a5628044ef4daacca943062eac3fd27a2eaec93"
      }
    },
    {
      "id": "src/economics.rs#epoch_boundaries_are_height_only@60",
      "name": "epoch_boundaries_are_height_only",
      "kind": "test_function",
      "source": {
        "path": "src/economics.rs",
        "line_start": 60,
        "sha": "f415428712ad99302ff54d6e090cb72e600570b6"
      },
      "signature_source": "fn epoch_boundaries_are_height_only() {",
      "docstring": null,
      "status": "DISCOVERED_NOT_SEMANTICALLY_VERIFIED",
      "contract": {
        "preconditions": "UNSPECIFIED",
        "postconditions": "UNSPECIFIED",
        "errors": "UNSPECIFIED",
        "side_effects": "UNSPECIFIED",
        "determinism": "UNSPECIFIED",
        "security_invariants": "UNSPECIFIED"
      },
      "evidence": {
        "tests": "NOT_RECONCILED",
        "exact_sha": "5a5628044ef4daacca943062eac3fd27a2eaec93"
      }
    },
    {
      "id": "src/economics.rs#subsidy_halves_at_each_boundary@70",
      "name": "subsidy_halves_at_each_boundary",
      "kind": "test_function",
      "source": {
        "path": "src/economics.rs",
        "line_start": 70,
        "sha": "f415428712ad99302ff54d6e090cb72e600570b6"
      },
      "signature_source": "fn subsidy_halves_at_each_boundary() {",
      "docstring": null,
      "status": "DISCOVERED_NOT_SEMANTICALLY_VERIFIED",
      "contract": {
        "preconditions": "UNSPECIFIED",
        "postconditions": "UNSPECIFIED",
        "errors": "UNSPECIFIED",
        "side_effects": "UNSPECIFIED",
        "determinism": "UNSPECIFIED",
        "security_invariants": "UNSPECIFIED"
      },
      "evidence": {
        "tests": "NOT_RECONCILED",
        "exact_sha": "5a5628044ef4daacca943062eac3fd27a2eaec93"
      }
    },
    {
      "id": "src/economics.rs#supply_cap_is_fail_closed@78",
      "name": "supply_cap_is_fail_closed",
      "kind": "test_function",
      "source": {
        "path": "src/economics.rs",
        "line_start": 78,
        "sha": "f415428712ad99302ff54d6e090cb72e600570b6"
      },
      "signature_source": "fn supply_cap_is_fail_closed() {",
      "docstring": null,
      "status": "DISCOVERED_NOT_SEMANTICALLY_VERIFIED",
      "contract": {
        "preconditions": "UNSPECIFIED",
        "postconditions": "UNSPECIFIED",
        "errors": "UNSPECIFIED",
        "side_effects": "UNSPECIFIED",
        "determinism": "UNSPECIFIED",
        "security_invariants": "UNSPECIFIED"
      },
      "evidence": {
        "tests": "NOT_RECONCILED",
        "exact_sha": "5a5628044ef4daacca943062eac3fd27a2eaec93"
      }
    },
    {
      "id": "src/economics.rs#final_emission_block_closes_integer_rounding_dust@83",
      "name": "final_emission_block_closes_integer_rounding_dust",
      "kind": "test_function",
      "source": {
        "path": "src/economics.rs",
        "line_start": 83,
        "sha": "f415428712ad99302ff54d6e090cb72e600570b6"
      },
      "signature_source": "fn final_emission_block_closes_integer_rounding_dust() {",
      "docstring": null,
      "status": "DISCOVERED_NOT_SEMANTICALLY_VERIFIED",
      "contract": {
        "preconditions": "UNSPECIFIED",
        "postconditions": "UNSPECIFIED",
        "errors": "UNSPECIFIED",
        "side_effects": "UNSPECIFIED",
        "determinism": "UNSPECIFIED",
        "security_invariants": "UNSPECIFIED"
      },
      "evidence": {
        "tests": "NOT_RECONCILED",
        "exact_sha": "5a5628044ef4daacca943062eac3fd27a2eaec93"
      }
    },
    {
      "id": "src/hash.rs#splitmix32@12",
      "name": "splitmix32",
      "kind": "rust_function",
      "source": {
        "path": "src/hash.rs",
        "line_start": 12,
        "sha": "97d3bee54f95caf2439765383041b0e120d1ab46"
      },
      "signature_source": "const fn splitmix32(state: u32) -> (u32, u32) {",
      "docstring": null,
      "status": "DISCOVERED_NOT_SEMANTICALLY_VERIFIED",
      "contract": {
        "preconditions": "UNSPECIFIED",
        "postconditions": "UNSPECIFIED",
        "errors": "UNSPECIFIED",
        "side_effects": "UNSPECIFIED",
        "determinism": "UNSPECIFIED",
        "security_invariants": "UNSPECIFIED"
      },
      "evidence": {
        "tests": "NOT_RECONCILED",
        "exact_sha": "5a5628044ef4daacca943062eac3fd27a2eaec93"
      }
    },
    {
      "id": "src/hash.rs#derive_iv@21",
      "name": "derive_iv",
      "kind": "rust_function",
      "source": {
        "path": "src/hash.rs",
        "line_start": 21,
        "sha": "97d3bee54f95caf2439765383041b0e120d1ab46"
      },
      "signature_source": "const fn derive_iv() -> [u32; 8] {",
      "docstring": null,
      "status": "DISCOVERED_NOT_SEMANTICALLY_VERIFIED",
      "contract": {
        "preconditions": "UNSPECIFIED",
        "postconditions": "UNSPECIFIED",
        "errors": "UNSPECIFIED",
        "side_effects": "UNSPECIFIED",
        "determinism": "UNSPECIFIED",
        "security_invariants": "UNSPECIFIED"
      },
      "evidence": {
        "tests": "NOT_RECONCILED",
        "exact_sha": "5a5628044ef4daacca943062eac3fd27a2eaec93"
      }
    },
    {
      "id": "src/hash.rs#derive_k@34",
      "name": "derive_k",
      "kind": "rust_function",
      "source": {
        "path": "src/hash.rs",
        "line_start": 34,
        "sha": "97d3bee54f95caf2439765383041b0e120d1ab46"
      },
      "signature_source": "const fn derive_k() -> [u32; 24] {",
      "docstring": null,
      "status": "DISCOVERED_NOT_SEMANTICALLY_VERIFIED",
      "contract": {
        "preconditions": "UNSPECIFIED",
        "postconditions": "UNSPECIFIED",
        "errors": "UNSPECIFIED",
        "side_effects": "UNSPECIFIED",